{
  "$schema": "http://json-schema.org/draft-07/schema#",
  "$id": "https://gleanwork.github.io/mcp-server-tester/schema/eval-dataset.schema.json",
  "title": "MCP Server Tester Eval Dataset",
  "description": "Schema for @gleanwork/mcp-server-tester eval dataset JSON files. Enables IDE autocomplete and validation for data/*.json files.",
  "type": "object",
  "required": ["name", "cases"],
  "additionalProperties": false,
  "properties": {
    "$schema": {
      "type": "string",
      "description": "JSON Schema reference URI"
    },
    "name": {
      "type": "string",
      "minLength": 1,
      "description": "Dataset name \u2014 should be unique and descriptive"
    },
    "description": {
      "type": "string",
      "description": "Human-readable description of what this dataset covers"
    },
    "cases": {
      "type": "array",
      "minItems": 1,
      "description": "Test cases in this dataset",
      "items": {
        "$ref": "#/definitions/EvalCase"
      }
    },
    "metadata": {
      "type": "object",
      "description": "Arbitrary additional metadata for the dataset",
      "additionalProperties": true
    }
  },
  "definitions": {
    "EvalCase": {
      "type": "object",
      "required": ["id", "input"],
      "additionalProperties": false,
      "description": "A single eval case: an input the client under test acts on, and assertions about what it did. Direct tool calls are Playwright tests (mcp.callTool() with the matchers), not cases.",
      "properties": {
        "id": {
          "type": "string",
          "minLength": 1,
          "description": "Unique identifier for this test case within the dataset"
        },
        "description": {
          "type": "string",
          "description": "Human-readable description of what this test case validates"
        },
        "input": {
          "type": "string",
          "description": "The user's request the client acts on, sent as its prompt.",
          "examples": [
            "Find recent docs about the example MCP server",
            "Who leads the developer platform team?"
          ],
          "minLength": 1
        },
        "client": {
          "type": "string",
          "minLength": 1,
          "description": "The client the case runs on: mst, claude-code, codex, cowork, chatgpt, or a plugin's <namespace>/client/<name>. Inherits the eval's (or the run's) client."
        },
        "model": {
          "type": "string",
          "description": "The model the client uses."
        },
        "clientOptions": {
          "type": "object",
          "description": "The client's own options, such as systemPrompt or skills for mst, or appVersion for cowork."
        },
        "trials": {
          "type": "integer",
          "minimum": 1,
          "default": 1,
          "description": "Number of trials (attempts at this case). When > 1, the case's pass rate is the share of trials that passed."
        },
        "passThreshold": {
          "type": "number",
          "minimum": 0,
          "maximum": 1,
          "default": 1.0,
          "description": "Share of trials (0\u20131) that must pass for the case to pass. Default 1 (every trial)."
        },
        "judgeReps": {
          "type": "integer",
          "minimum": 1,
          "description": "Number of times to run each of the case's judges; scores are averaged. A judge's own reps overrides it."
        },
        "expected": {
          "type": "object",
          "description": "What the case expects, for graders: answer (the reference answer), criteria (rubric criteria by name), and any other ground truth.",
          "properties": {
            "answer": {
              "description": "The reference answer judges compare against."
            },
            "criteria": {
              "type": "object",
              "additionalProperties": {
                "type": "string"
              }
            }
          }
        },
        "tags": {
          "type": "array",
          "items": {
            "type": "string"
          },
          "description": "Labels for filtering runs and slicing results, such as 'regression'."
        },
        "metadata": {
          "type": "object",
          "description": "Arbitrary additional metadata for this test case",
          "additionalProperties": true
        },
        "assertions": {
          "$ref": "#/definitions/EvalAssertions",
          "description": "Assertions (code graders) each trial must pass."
        },
        "judges": {
          "type": "array",
          "description": "Judges (model graders) that score each trial; each must pass. They run on top of the eval config's judges; for a judge both list, the case's settings win. Each entry is a reference or { type, ...options }, as in an eval config.",
          "items": {
            "$ref": "#/definitions/CaseJudge"
          }
        }
      }
    },
    "EvalAssertions": {
      "type": "object",
      "additionalProperties": false,
      "description": "Assertions to check against what the client did. Multiple fields can be combined; all must pass.",
      "properties": {
        "containsText": {
          "oneOf": [
            {
              "type": "string"
            },
            {
              "type": "array",
              "items": {
                "type": "string"
              },
              "minItems": 1
            }
          ],
          "description": "Substring(s) that must appear in the response text. All provided strings must be present. Corresponds to toContainToolText()."
        },
        "matchesPattern": {
          "oneOf": [
            {
              "type": "string"
            },
            {
              "type": "array",
              "items": {
                "type": "string"
              },
              "minItems": 1
            }
          ],
          "description": "Regular expression pattern(s) that must match the response text. All provided patterns must match. Corresponds to toMatchToolPattern()."
        },
        "toolsTriggered": {
          "$ref": "#/definitions/ToolsTriggered"
        },
        "toolCallCount": {
          "$ref": "#/definitions/ToolCallCount"
        }
      }
    },
    "CaseJudge": {
      "description": "One of a case's judges: a reference (\"acme/judge/completeness\") or { type, ...options } (\"type\": \"rubric\" with a rubric, or a plugin judge).",
      "oneOf": [
        {
          "type": "string",
          "minLength": 1,
          "not": {
            "enum": ["rubric", "mst/judge/rubric"]
          },
          "examples": ["acme/judge/completeness"]
        },
        {
          "type": "object",
          "required": ["type"],
          "additionalProperties": false,
          "description": "The built-in rubric judge: an LLM scores the response against the rubric. Needs rubric (or options.rubric).",
          "properties": {
            "type": {
              "description": "The built-in rubric judge.",
              "enum": ["rubric", "mst/judge/rubric"]
            },
            "rubric": {
              "oneOf": [
                {
                  "type": "string",
                  "enum": [
                    "correctness",
                    "completeness",
                    "groundedness",
                    "instruction-following",
                    "conciseness"
                  ],
                  "description": "Built-in rubric name"
                },
                {
                  "type": "object",
                  "required": ["text"],
                  "properties": {
                    "text": {
                      "type": "string",
                      "minLength": 1,
                      "description": "Custom rubric text"
                    }
                  },
                  "additionalProperties": false
                }
              ],
              "description": "Evaluation rubric: a built-in name ('correctness', 'completeness', etc.) or custom { text: string }"
            },
            "reference": {
              "description": "Optional reference response to compare against during judging"
            },
            "threshold": {
              "type": "number",
              "minimum": 0,
              "maximum": 1,
              "default": 0.7,
              "description": "Minimum score (0\u20131) required to pass the judge evaluation"
            },
            "reps": {
              "type": "integer",
              "minimum": 1,
              "description": "Number of judge evaluations to run; scores are averaged. Overrides EvalCase.judgeReps."
            },
            "provider": {
              "type": "string",
              "enum": [
                "anthropic",
                "vertex-anthropic",
                "anthropic-agent-sdk",
                "openai",
                "google"
              ],
              "description": "Judge LLM provider. Defaults to 'anthropic'."
            },
            "model": {
              "type": "string",
              "description": "Model override for the judge LLM (e.g., 'claude-opus-4-20250514')."
            },
            "apiKeyEnvVar": {
              "type": "string",
              "description": "Environment variable name that holds the API key for the judge provider."
            },
            "maxTokens": {
              "type": "integer",
              "minimum": 1,
              "description": "Maximum tokens for the judge LLM response."
            },
            "temperature": {
              "type": "number",
              "minimum": 0,
              "maximum": 1,
              "description": "Temperature for the judge LLM (0 = deterministic, 1 = max creativity)."
            },
            "maxBudgetUsd": {
              "type": "number",
              "exclusiveMinimum": 0,
              "description": "Maximum budget in USD per judge evaluation."
            },
            "maxToolOutputSize": {
              "type": "integer",
              "minimum": 1,
              "description": "Fail if the response exceeds this size in bytes before judging."
            },
            "options": {
              "type": "object",
              "description": "The judge's options, instead of flat fields."
            }
          }
        },
        {
          "type": "object",
          "required": ["type"],
          "additionalProperties": true,
          "description": "A plugin judge, <namespace>/judge/<name>. Fields other than threshold, reference and reps (or options) are the judge's options.",
          "properties": {
            "type": {
              "type": "string",
              "minLength": 1,
              "not": {
                "enum": ["rubric", "mst/judge/rubric"]
              }
            },
            "reference": {
              "description": "Reference answer to compare against. Default: the case's expected.answer."
            },
            "threshold": {
              "type": "number",
              "minimum": 0,
              "maximum": 1,
              "default": 0.7,
              "description": "Minimum score (0\u20131) required to pass the judge evaluation"
            },
            "reps": {
              "type": "integer",
              "minimum": 1,
              "description": "Number of judge evaluations to run; scores are averaged. Overrides EvalCase.judgeReps."
            },
            "options": {
              "type": "object",
              "description": "The judge's options, instead of flat fields."
            }
          }
        }
      ]
    },
    "ToolsTriggered": {
      "type": "object",
      "required": ["calls"],
      "additionalProperties": false,
      "description": "Asserts which tools the client called. Only meaningful for client cases. Corresponds to toHaveToolCalls().",
      "properties": {
        "calls": {
          "type": "array",
          "minItems": 1,
          "description": "Expected tool calls. Each entry describes one tool invocation the LLM should have made.",
          "items": {
            "$ref": "#/definitions/ExpectedToolCall"
          }
        },
        "order": {
          "type": "string",
          "enum": ["strict", "any"],
          "default": "any",
          "description": "'strict': calls must appear in the exact order listed. 'any': calls can appear in any order."
        },
        "exclusive": {
          "type": "boolean",
          "default": false,
          "description": "If true, no tool calls outside the listed 'calls' are allowed. If false, extra tool calls are permitted."
        }
      }
    },
    "ExpectedToolCall": {
      "type": "object",
      "required": ["name"],
      "additionalProperties": false,
      "description": "A single expected tool call within toolsTriggered.calls",
      "properties": {
        "name": {
          "type": "string",
          "description": "Name of the tool the LLM must have called",
          "examples": ["search", "get_weather", "create_issue", "list_files"]
        },
        "arguments": {
          "type": "object",
          "description": "Expected arguments (partial match \u2014 extra keys in the actual call are allowed)",
          "additionalProperties": true
        },
        "required": {
          "type": "boolean",
          "default": true,
          "description": "Whether this tool call MUST have been made. Set to false to assert an optional call."
        }
      }
    },
    "ToolCallCount": {
      "type": "object",
      "additionalProperties": false,
      "description": "Asserts the total number of tool calls the client made. Only meaningful for client cases. Corresponds to toHaveToolCallCount().",
      "properties": {
        "min": {
          "type": "integer",
          "minimum": 0,
          "description": "Minimum number of tool calls that must have been made"
        },
        "max": {
          "type": "integer",
          "minimum": 0,
          "description": "Maximum number of tool calls allowed"
        },
        "exact": {
          "type": "integer",
          "minimum": 0,
          "description": "Exact number of tool calls required. Mutually exclusive with min/max."
        }
      }
    }
  }
}
