{
  "name": "Filesystem MCP Server Evaluation",
  "description": "Eval cases: requests a model should handle with this server's tools.",
  "cases": [
    {
      "id": "should discover docs directory",
      "description": "LLM discovers and lists files in docs directory",
      "input": "What files are in the docs directory?",
      "client": "mst",
      "model": "claude-sonnet-4-5",
      "clientOptions": {
        "temperature": 0.0,
        "maxTokens": 1000
      },
      "assertions": {
        "containsText": ["guide.md", "api.md"],
        "toolsTriggered": {
          "calls": [
            {
              "name": "list_directory",
              "required": true
            }
          ]
        }
      }
    },
    {
      "id": "should extract version from config using Anthropic",
      "description": "LLM (Anthropic) reads config and extracts version",
      "input": "Read the config.json file and tell me what version it is.",
      "client": "mst",
      "model": "claude-sonnet-4-5",
      "clientOptions": {
        "temperature": 0.0,
        "maxTokens": 1000
      },
      "assertions": {
        "containsText": "1.0.0",
        "toolsTriggered": {
          "calls": [
            {
              "name": "read_file",
              "required": true
            }
          ]
        }
      }
    },
    {
      "id": "should find all markdown files",
      "description": "LLM finds all markdown files",
      "input": "Find all markdown files in this project.",
      "client": "mst",
      "model": "claude-sonnet-4-5",
      "clientOptions": {
        "temperature": 0.0
      },
      "assertions": {
        "containsText": [".md"],
        "toolsTriggered": {
          "calls": [
            {
              "name": "search_files",
              "required": true
            }
          ]
        }
      }
    },
    {
      "id": "should analyze CSV data and count users",
      "description": "LLM reads CSV and provides analysis",
      "input": "How many users are listed in the data/users.csv file?",
      "client": "mst",
      "model": "claude-sonnet-4-5",
      "clientOptions": {
        "temperature": 0.0
      },
      "assertions": {
        "containsText": ["2", "Alice", "Bob"],
        "toolsTriggered": {
          "calls": [
            {
              "name": "read_file",
              "required": true
            }
          ]
        }
      }
    },
    {
      "id": "should list all project files",
      "description": "LLM provides complete file listing",
      "input": "Show me all files and directories in this project.",
      "client": "mst",
      "model": "claude-sonnet-4-5",
      "clientOptions": {
        "temperature": 0.0
      },
      "assertions": {
        "toolsTriggered": {
          "calls": [
            {
              "name": "list_directory",
              "required": true
            }
          ]
        }
      }
    }
  ],
  "metadata": {
    "author": "MCP Eval Examples",
    "version": "1.0.0",
    "notes": [
      "This dataset tests the official Filesystem MCP server from Anthropic",
      "Direct mode tests specific file operations with known paths",
      "LLM client mode tests tool discovery and natural language understanding",
      "All files are created in temporary directories using fixturify-project",
      "No API keys required for direct mode tests",
      "LLM tests require ANTHROPIC_API_KEY environment variable"
    ]
  }
}
